title,genres,keywords,tagline,cast,director
Imagine That,Comedy,,What if your daughter's imagination... Was the secret to your success?,Eddie Murphy Thomas Haden Church Yara Shahidi Ronny Cox Stephen Rannazzisi,Karey Kirkpatrick
Steve Jobs,Drama History,biography computer father daughter relationship apple computer steve jobs,Can a great man be a good man?,Michael Fassbender Kate Winslet Seth Rogen Katherine Waterston Jeff Daniels,Danny Boyle
Collateral Damage,Action Thriller Drama,terrorist fbi colombia firemen revenge,What would you do if you lost everything?,Arnold Schwarzenegger Francesca Neri Elias Koteas Cliff Curtis John Turturro,Andrew Davis
The World Is Not Enough,Adventure Action Thriller,british mission oil heiress bilbao spain,As the countdown begins for the new millennium there is still one number you can always count on.,Pierce Brosnan Sophie Marceau Robert Carlyle Denise Richards Robbie Coltrane,Michael Apted
Hollywood Homicide,Action Adventure Comedy Thriller,rap music hitman,,Harrison Ford Josh Hartnett Lena Olin Bruce Greenwood Isaiah Washington,Ron Shelton
Paranormal Activity 4,Horror,garage poltergeist webcam imaginary friend bathtub,It's closer than you think,Katie Featherston Kathryn Newton Matt Shively Aiden Lovekamp Brady Allen,Henry Joost
My Fair Lady,Drama Family Music Romance,musical transformation flower girl colonel wager,The loverliest motion picture of them all!,Audrey Hepburn Rex Harrison Stanley Holloway Wilfrid Hyde-White Gladys Cooper,George Cukor
Anchorman: The Legend of Ron Burgundy,Comedy,journalism sexism ladder panda tv show in film,They bring you the news so you don't have to get it yourself.,Will Ferrell Christina Applegate Paul Rudd David Koechner Steve Carell,Adam McKay
Mississippi Mermaid,Crime Drama Romance,exotic island secret love of one's life plantation marriage,The Bride Came as Advertised...With an Unadvertised Special,Jean-Paul Belmondo Catherine Deneuve Michel Bouquet Nelly Borgeaud Martine Ferri\u00e8re,Fran\u00e7ois Truffaut
The 40 Year Old Virgin,Comedy Romance,first time virgin,"The longer you wait, the harder it gets",Steve Carell Catherine Keener Paul Rudd Romany Malco Seth Rogen,Judd Apatow
The Other Conquest,Drama Foreign,female nudity pagan aztec indian,The spirit of a people can never be conquered.,Dami\u00e1n Delgado Jos\u00e9 Carlos Rodr\u00edguez Elpidia Carrillo I\u00f1aki Aierra Honorato Magaloni,Salvador Carrasco
The Social Network,Drama,hacker hacking creator frat party social network,You don't get to 500 million friends without making a few enemies.,Jesse Eisenberg Andrew Garfield Justin Timberlake Armie Hammer Max Minghella,David Fincher
The Bad Lieutenant: Port of Call - New Orleans,Drama Crime,police brutality organized crime policeman illegal drugs murder investigation,The only criminal he can't catch is himself.,Nicolas Cage Eva Mendes Val Kilmer Fairuza Balk Shawn Hatosy,Werner Herzog
Religulous,Comedy Documentary,muslim museum jew evidence rabbi,Heaven help us.,Bill Maher Jose Luis De Jesus Miranda Andrew Newberg Steve Burg Tal Bachman,Larry Charles
Predator 2,Science Fiction Action Thriller,predator war on drugs extraterrestrial technology los angeles invisible,Silent. Invisible. Invincible. He's in town with a few days to kill.,Kevin Peter Hall Danny Glover Gary Busey Rub\u00e9n Blades Mar\u00eda Conchita Alonso,Stephen Hopkins
Abduction,Thriller Action Mystery,cia airport hero fight kidnapping,They stole his life. He's taking it back.,Taylor Lautner Lily Collins Alfred Molina Jason Isaacs Maria Bello,John Singleton
Faith Connections,Documentary Drama,himalaya hindu pilgrimage faith hinduism,,Bhole Baba Hatha Yogi Baba Pant Shirt Baba Baby Bajrangi Shriman Umeshanad Brahmachari,Pan Nalin
A Room with a View,Drama Romance,kiss bed and breakfast place florence,,Maggie Smith Helena Bonham Carter Denholm Elliott Julian Sands Simon Callow,James Ivory
Signs,Drama Thriller Science Fiction Mystery,symbolism water farm faith alien,Itâ€™s not like they didnâ€™t warn us.,Mel Gibson Joaquin Phoenix Rory Culkin Abigail Breslin Cherry Jones,M. Night Shyamalan
Trees Lounge,Comedy Drama,bar alcoholism independent film drinking,,Steve Buscemi Chlo\u00eb Sevigny Carol Kane Mark Boone Junior Bronson Dudley,Steve Buscemi
It Follows,Horror Thriller,chase supernatural friends vision school,"It doesn't think, it doesn't feel, it doesn't give up",Maika Monroe Keir Gilchrist Daniel Zovatto Jake Weary Olivia Luccardi,David Robert Mitchell
A View to a Kill,Adventure Action Thriller,paris london england france england san francisco,Has James Bond finally met his match?,Roger Moore Christopher Walken Tanya Roberts Grace Jones Patrick Macnee,John Glen
8MM,Thriller Crime Mystery,pornography porn actor loss of daughter child pornography private investigator,You can't prepare for where the truth will take you.,Nicolas Cage Joaquin Phoenix James Gandolfini Chris Bauer Anthony Heald,Joel Schumacher
Rent,Drama Romance,gay sex aids musical hiv,No day but today.,Anthony Rapp Adam Pascal Rosario Dawson Jesse L. Martin Wilson Jermaine Heredia,Chris Columbus
Much Ado About Nothing,Drama Comedy Romance,shakespeare bachelor new love rage and hate lover,Romance. Mischief. Seduction. Revenge. Remarkable.,Kenneth Branagh Richard Briers Michael Keaton Robert Sean Leonard Keanu Reeves,Kenneth Branagh
Dying of the Light,Thriller Drama,cia retirement espionage terrorism,,Nicolas Cage Anton Yelchin Alexander Karim Ir\u00e8ne Jacob Aymen Hamdouchi,Paul Schrader
The Cold Light of Day,Action Thriller,kidnapping spying government,Be careful who you trust.,Henry Cavill Ver\u00f3nica Echegui Sigourney Weaver Bruce Willis Caroline Goodall,Mabrouk El Mechri
Mean Girls,Comedy,female friendship high school fish out of water best friend teenager,Welcome to girl world.,Lindsay Lohan Rachel McAdams Tim Meadows Ana Gasteyer Amy Poehler,Mark Waters
Sex Tape,Comedy,marriage internet relationship family sex tape,A movie about a movie they don't want you to see.,Cameron Diaz Jason Segel Rob Corddry Ellie Kemper Rob Lowe,Jake Kasdan
Eight Below,Adventure Drama Family,expedition pilot survival sled dogs seal,"The Most Amazing Story Of Survival, Friendship, And Adventure Ever Told.",Paul Walker Bruce Greenwood Moon Bloodgood Jason Biggs Gerard Plunkett,Frank Marshall
New York Minute,Comedy,twin sister music video geek vacation university,,Ashley Olsen Mary-Kate Olsen Eugene Levy Andy Richter Riley Smith,Dennie Gordon
Ice Age: Continental Drift,Animation Comedy Adventure Family,blue footed booby prehistoric times melting ice badger elephant seal,"Manny, Diego, and Sid embark upon another adventure after their continent is set adrift.",John Leguizamo Ray Romano Chris Wedge Denis Leary Seann William Scott,Steve Martino
Prisoners,Drama Thriller Crime,pennsylvania kidnapping maze vigilante rural setting,Every moment matters.,Hugh Jackman Jake Gyllenhaal Paul Dano Maria Bello Melissa Leo,Denis Villeneuve
The Mist,Science Fiction Horror Thriller,father son relationship monster supermarket fight artist,"Belief divides them, mystery surrounds them, but fear changes everything.",Thomas Jane Marcia Gay Harden Laurie Holden Andre Braugher Toby Jones,Frank Darabont
Annie Get Your Gun,Action Comedy Music Romance Western,musical annie oakley sharpshooter,,Betty Hutton Howard Keel Louis Calhern J. Carrol Naish Edward Arnold,George Sidney
The Names of Love,Drama Comedy Romance,female nudity political voting results,"Make Love, Not War",Jacques Gamblin Sara Forestier Zinedine Soualem Jacques Boudet Carole Franck,Michel Leclerc
Wicker Park,Drama Mystery Romance Thriller,love of one's life leave look-alike intrigue,Passion never dies.,Josh Hartnett Rose Byrne Matthew Lillard Diane Kruger Christopher Cousins,Paul McGuigan
The Prestige,Drama Mystery Thriller,competition secret obsession magic dying and death,Are You Watching Closely?,Hugh Jackman Christian Bale Michael Caine Scarlett Johansson Andy Serkis,Christopher Nolan
The Insider,Drama Thriller,spy newspaper research interview tobacco,Two men driven to tell the truth... whatever the cost.,Al Pacino Russell Crowe Christopher Plummer Diane Venora Bruce McGill,Michael Mann
Kick-Ass 2,Action Adventure Crime,crime fighter secret identity marvel comic superhero aftercreditsstinger,You Can't Fight Your Destiny.,Aaron Taylor-Johnson Chlo\u00eb Grace Moretz Christopher Mintz-Plasse Clark Duke Jim Carrey,Jeff Wadlow
Our Family Wedding,Comedy,interracial marriage wedding duringcreditsstinger,To have and to hold... 'Til dads do us part.,Forest Whitaker America Ferrera Carlos Mencia Regina King Lance Gross,Rick Famuyiwa
Get Him to the Greek,Comedy,aftercreditsstinger,Aaron Green has 72 hours to get a Rock Star from London to L.A. Pray for him.,Jonah Hill Russell Brand Rose Byrne Elisabeth Moss Colm Meaney,Nicholas Stoller
Finding Nemo,Animation Family,father son relationship harbor underwater fish tank great barrier reef,"There are 3.7 trillion fish in the ocean, they're looking for one.",Albert Brooks Ellen DeGeneres Alexander Gould Willem Dafoe Brad Garrett,Andrew Stanton
Out of the Blue,Drama,new zealand gun rampage police independent film neighbor,The true story of a small town massacre,Karl Urban Tandi Wright Simon Ferry Matthew Sunderland Lois Lawn,Robert Sarkies
Deck the Halls,Comedy Family,holiday massachusetts neighbor christmas,There glows the neighborhood,Danny DeVito Matthew Broderick Kristin Davis Kristin Chenoweth Fred Armisen,John Whitesell
Trucker,Drama,california sex bar motel highway,Some Things in life you can't leave behind,Michelle Monaghan Nathan Fillion Joey Lauren Adams Jimmy Bennett Mika Boorem,James Mottern
Boomerang,Comedy Romance,role of women ladykiller success ladies' man chefin,A Player Who's About to be Played.,Eddie Murphy Robin Givens Halle Berry David Alan Grier Grace Jones,Reginald Hudlin
The Perks of Being a Wallflower,Drama Romance,shyness secret narration kiss freshman,We are infinite.,Logan Lerman Emma Watson Ezra Miller Paul Rudd Nina Dobrev,Stephen Chbosky
Not Cool,Comedy,sex thanksgiving friendship high school love,,Shane Dawson Cherami Leigh Drew Monson Michelle Veintimilla Lisa Schwartz,Shane Dawson
Larry Crowne,Comedy Romance Drama,classroom college teacher diner loss of job,Rediscover life and love,Tom Hanks Julia Roberts Bryan Cranston Cedric the Entertainer Pam Grier,Tom Hanks
Redbelt,Drama,film making film producer video surveillance sport interracial marriage,There's always a way out. You just have to find it.,Chiwetel Ejiofor Tim Allen Alice Braga Jose Pablo Cantillo Randy Couture,David Mamet
Babel,Drama,terror loss of mother gun morocco deaf-mute,If You Want to be Understood...Listen,Brad Pitt Cate Blanchett Gael Garc\u00eda Bernal Rinko Kikuchi Adriana Barraza,Alejandro Gonz\u00e1lez I\u00f1\u00e1rritu
An Unfinished Life,Drama,loss of son sheriff wyoming grandfather granddaughter relationship violence against women,Every secret takes on a life of its own.,Robert Redford Jennifer Lopez Morgan Freeman Becca Gardner Josh Lucas,Lasse Hallstr\u00f6m
A Farewell to Arms,Drama Romance War,italy nurse love letter officer priest,Every woman who has loved will understand,Helen Hayes Gary Cooper Adolphe Menjou Mary Philips Jack La Rue,Frank Borzage
The Bridges of Madison County,Drama Romance,farewell adultery love at first sight photographer wife husband relationship,The path of Francesca Johnson's future seems destined due to an unexpected fork in the road...,Meryl Streep Clint Eastwood Annie Corley Victor Slezak Jim Haynie,Clint Eastwood
Home Fries,Drama Comedy Romance,waitress infidelity planned murder pregnancy and birth funeral,A long shot romance in a short order world.,Drew Barrymore Catherine O'Hara Luke Wilson Jake Busey Shelley Duvall,Dean Parisot
Flash of Genius,Drama,biography,"Corporations have time, money, and power on their side. All Bob Kearns had was the truth.",Aaron Abrams Alan Alda Lauren Graham Greg Kinnear Tatiana Maslany,Marc Abraham
Rize,Documentary,street gang hip-hop dance fight breakdance,,Christopher Toler Tommy the Clown Miss Prissy Dragon Ceasare Willis,David LaChapelle
Mad Max,Adventure Action Thriller Science Fiction,chain baby bridge post-apocalyptic dystopia,The Maximum Force Of The Future,Mel Gibson Joanne Samuel Hugh Keays-Byrne Steve Bisley Tim Burns,George Miller
Forrest Gump,Comedy Drama Romance,vietnam veteran hippie mentally disabled running based on novel,"The world will never be the same, once you've seen it through the eyes of Forrest Gump.",Tom Hanks Robin Wright Gary Sinise Mykelti Williamson Sally Field,Robert Zemeckis
The Life Aquatic with Steve Zissou,Adventure Comedy Drama,ocean film making loss of mother cynic red cap,"The deeper you go, the weirder life gets.",Bill Murray Anjelica Huston Cate Blanchett Willem Dafoe Owen Wilson,Wes Anderson
Octopussy,Adventure Action Thriller,atomic bomb eastern block crocodile secret intelligence service kgb,James Bondâ€™s all time high.,Roger Moore Maud Adams Louis Jourdan Kristina Wayborn Kabir Bedi,John Glen
"Crouching Tiger, Hidden Dragon",Adventure Drama Action Romance,flying martial arts taskmaster comb tiger,"A timeless story of strength, secrets and two warriors who would never surrender.",Chow Yun-fat Michelle Yeoh Zhang Ziyi Chang Chen Cheng Pei-Pei,Ang Lee
Safe,Action Crime Thriller,broken trachea,She has the code. He is the key.,Jason Statham Chris Sarandon James Hong Catherine Chan Robert John Burke,Boaz Yakin
Honey,Romance Music Family,new york dancing hip-hop dream dance,Her dream. Her terms,Jessica Alba Mekhi Phifer Joy Bryant Romeo Miller David Moscow,Bille Woodruff
Where the Truth Lies,Drama Mystery Thriller,sex journalist journalism 1970s entertainer,,Kevin Bacon Colin Firth Alison Lohman David Hayman Rachel Blanchard,Atom Egoyan
The Wackness,Drama,coming of age marijuana summer,,Ben Kingsley Famke Janssen Josh Peck Olivia Thirlby Mary-Kate Olsen,Jonathan Levine
The Haunting of Molly Hartley,Drama Horror,,Her past is yet to come.,Haley Bennett Jake Weber Chace Crawford Shannon Woodward Shanna Collins,Mickey Liddell
Black Rain,Action Thriller Crime,japan yakuza japanese mafia,Their country. Their laws. Their game. His rules.,Michael Douglas Andy Garc\u00eda Kate Capshaw Shigeru K\u00f4yama John Spencer,Ridley Scott
My Blueberry Nights,Drama Romance,usa kaffeehaus poker lovesickness waitress,How do you say goodbye to someone you can't imagine living without?,Norah Jones Jude Law Natalie Portman David Strathairn Rachel Weisz,Wong Kar-wai
The Incredible Hulk,Science Fiction Action Adventure,new york rio de janeiro marvel comic superhero based on comic book,You'll like him when he's angry.,Edward Norton Liv Tyler Tim Roth William Hurt Tim Blake Nelson,Louis Leterrier
Sky High,Adventure Comedy Family,hero loyalty mockery supernatural powers high school,Saving The World... One Homework Assignment At A Time.,Michael Angarano Kurt Russell Kelly Preston Danielle Panabaker Kevin Heffernan,Mike Mitchell
The Four Seasons,Comedy Drama Romance,,,Alan Alda Carol Burnett Len Cariou Sandy Dennis Rita Moreno,Alan Alda
The Fog,Horror,prophecy sea beach gold small town,Lock your doors. Bolt your windows. There's something in THE FOG!,Adrienne Barbeau Jamie Lee Curtis Janet Leigh John Houseman Tom Atkins,John Carpenter
The Protector,Action Crime Drama Thriller,buddhism elephant sydney australia fighter,Vengeance Knows No Mercy,Tony Jaa Petchtai Wongkamlao Bongkoj Khongmalai Xing Jing Nathan Jones,Prachya Pinkaew
Ghost Rider,Thriller Action Fantasy Horror,mephisto religion and supernatural dying and death devil's son ghost world,Hell Is About To Be Unleashed,Nicolas Cage Eva Mendes Wes Bentley Donal Logue Sam Elliott,Mark Steven Johnson
Rabbit Hole,Drama,loss of son trauma toy marriage grief,The only way out is through.,Nicole Kidman Aaron Eckhart Dianne Wiest Miles Teller Tammy Blanchard,John Cameron Mitchell
Bound,Crime Drama Romance Thriller,prison women's prison suspense mafia lesbian,"In their world, you can't buy freedom, but you can steal it.",Jennifer Tilly Gina Gershon Joe Pantoliano John P. Ryan Christopher Meloni,Lilly Wachowski
The Green Mile,Fantasy Drama Crime,southern usa black people mentally disabled based on novel heal,Miracles do happen.,Tom Hanks Michael Clarke Duncan David Morse Bonnie Hunt James Cromwell,Frank Darabont
Saw: The Final Chapter,Horror Crime,survivor violence self help guru tricycle prosthetic arm,The Traps Come Alive,Tobin Bell Costas Mandylor Betsy Russell Cary Elwes Sean Patrick Flanery,Kevin Greutert
Jackass 3D,Comedy Documentary Action,pain stunts stuntman stupidity comedy,Don't try this at home,Johnny Knoxville Bam Margera Ryan Dunn Steve-O Chris Pontius,Jeff Tremaine
Tammy,Comedy,,She hit the road. The road hit back.,Melissa McCarthy Susan Sarandon Kathy Bates Allison Janney Dan Aykroyd,Ben Falcone
Rambo: First Blood Part II,Action Adventure Thriller War,usa vietnam veteran submachine gun prisoner prisoners of war,"What most people call hell, he calls home.",Sylvester Stallone Richard Crenna Charles Napier Steven Berkoff Julia Nickson,George P. Cosmatos
The Rite,Drama Thriller Horror,vatican violinist hospital miscarriage exorcist,You can only defeat it when you believe.,Anthony Hopkins Colin O'Donoghue Alice Braga Toby Jones Ciar\u00e1n Hinds,Mikael H\u00e5fstr\u00f6m
1911,Adventure Drama Action History War,martial arts sword revolution blood gunfight,Fall of the Last Empire,Jackie Chan Li Bingbing Joan Chen Jaycee Chan Sun Chun,Jackie Chan
Old School,Comedy,sex doll streaking mouth to mouth resuscitation,"All the fun of college, none of the education.",Luke Wilson Will Ferrell Vince Vaughn Ellen Pompeo Leah Remini,Todd Phillips
Meet the Deedles,Animation Comedy Family,,Fish out of water...Surfers in Yellowstone,Paul Walker John Ashton Dennis Hopper Eric Braeden Richard Lineback,Steve Boyum
Casa De Mi Padre,Comedy Western,mexico organized crime drug lord padre aftercreditsstinger,Funniest movie you'll ever read.,Will Ferrell Gael Garc\u00eda Bernal G\u00e9nesis Rodr\u00edguez Diego Luna Efren Ramirez,Matt Piedmont
The Usual Suspects,Drama Crime Thriller,law relatives theft criminal criminal mastermind,Five Criminals. One Line Up. No Coincidence.,Stephen Baldwin Gabriel Byrne Chazz Palminteri Kevin Pollak Pete Postlethwaite,Bryan Singer
Lady in the Water,Drama Thriller Fantasy Mystery,fortune teller religion and supernatural supernatural powers mythical creature hell,Time is running out for a happy ending.,Paul Giamatti Jeffrey Wright Bob Balaban Sarita Choudhury Cindy Cheung,M. Night Shyamalan
Bad Grandpa,Comedy,duringcreditsstinger,Real people. Real reactions. Real messed up.,Johnny Knoxville Jackson Nicoll Georgina Cates Spike Jonze Catherine Keener,Jeff Tremaine
The Dog Lover,Drama,undercover dog animal welfare animal rights organization puppy mill,She ended up on the wrong side of right.,Allison Paige James Remar Lea Thompson Jayson Blair Sherry Stringfield,Alex Ranarivelo
Shallow Hal,Comedy Romance,overweight beauty hypnosis overweight man overweight woman,Are You A Shallow Guy?,Gwyneth Paltrow Jack Black Jason Alexander Joe Viterelli Bruce McGill,Bobby Farrelly
The Dukes of Hazzard,Action Adventure Comedy,sheriff farm bikini redneck moonshine,Cousins. Outlaws. Thrillbillies.,Johnny Knoxville Seann William Scott Jessica Simpson Willie Nelson Burt Reynolds,Jay Chandrasekhar
The Hunt,Drama,father son relationship denmark lie pedophilia kindergarten,The lie is spreading.,Mads Mikkelsen Alexandra Rapaport Thomas Bo Larsen Anne Louise Hassing Lars Ranthe,Thomas Vinterberg
The R.M.,Comedy Crime Family,,Just when you thought it was safe to go back into the world...,Kirby Heyborne,Kurt Hale
Hoop Dreams,Documentary,chicago sports team ghetto narration college,An Extraordinary True Story.,William Gates Arthur Agee Steve James,Steve James
American Wedding,Comedy Romance,handcuffs sister sister relationship spanner blow job stag night,Forever hold your piece.,Jason Biggs Alyson Hannigan Seann William Scott Eddie Kaye Thomas Thomas Ian Nicholas,Jesse Dylan
Ira & Abby,Comedy Romance,independent film,"First comes love, then comes marriage, then comes therapy.",Chris Messina Jennifer Westfeldt David Margulies Kali Rocha Kevin Sussman,Robert Cary
The 13th Warrior,Adventure Fantasy Action,witch cave arabian scandinavia bagdad,Prey for the living.,Antonio Banderas Vladimir Kulich Dennis Storh\u00f8i Daniel Southern Clive Russell,John McTiernan
Where the Wild Things Are,Family Fantasy,children's book igloo wolf costume swallowed whole hit with a rock,There's one in all of us.,Max Records Catherine Keener Lauren Ambrose James Gandolfini Catherine O'Hara,Spike Jonze
21 Jump Street,Action Comedy Crime,male friendship high school parody crude humor based on tv series,They thought the streets were mean. Then they went back to high school.,Channing Tatum Jonah Hill Brie Larson Dave Franco Ellie Kemper,Phil Lord
Oculus,Horror,hallucination supernatural mirror skepticism ghost,You see what it wants you to see,Karen Gillan Brenton Thwaites Katee Sackhoff James Lafferty Rory Cochrane,Mike Flanagan
The Chambermaid on the Titanic,Drama,,,Olivier Martinez Aitana S\u00e1nchez-Gij\u00f3n Romane Bohringer Didier Bezace,Bigas Luna
The Deep End of the Ocean,Drama Mystery,kidnapping boy reunion,The search for her son was over. The search for her family was just beginning.,Michelle Pfeiffer Treat Williams Whoopi Goldberg Jonathan Jackson Cory Buck,Ulu Grosbard
The Scarlet Letter,Drama History Romance,based on novel burning of witches puritan pregnancy period drama,"When intimacy is forbidden and passion is a sin, love is the most defiant crime of all.",Demi Moore Gary Oldman Robert Duvall Robert Prosky Edward Hardwicke,Roland Joff\u00e9
Some Like It Hot,Comedy Romance,chicago witness musician mafia cross dressing,The movie too HOT for words!,Marilyn Monroe Tony Curtis Jack Lemmon George Raft Pat O\u2019Brien,Billy Wilder
How to Be Single,Comedy Romance,new york based on novel one-night stand single,Welcome to the party,Dakota Johnson Rebel Wilson Alison Brie Nicholas Braun Damon Wayans Jr.,Christian Ditter
Tropic Thunder,Action Comedy,film making satire jungle movie star southeast asia,The movie they think they're making... isn't a movie anymore.,Ben Stiller Jack Black Robert Downey Jr. Nick Nolte Steve Coogan,Ben Stiller
Nerve,Mystery Adventure Crime,based on novel technology internet hacking teenager,Are you a watcher or a player?,Emma Roberts Dave Franco Emily Meade Miles Heizer Juliette Lewis,Henry Joost
Prophecy,Horror Science Fiction,monster mutant toxic native american environmental,,Talia Shire Robert Foxworth Armand Assante Richard Dysart Victoria Racimo,John Frankenheimer
Philadelphia,Drama,gay aids homophobia jurors court,No one would take on his case... until one man was willing to take on the system.,Tom Hanks Denzel Washington Jason Robards Mary Steenburgen Antonio Banderas,Jonathan Demme
Aquamarine,Fantasy Romance Family Comedy,female friendship mermaid teenager woman director,A Fish-Out-Of-Water Comedy.,Emma Roberts Joanna 'JoJo' Levesque Sara Paxton Jake McDorman Arielle Kebbel,Elizabeth Allen Rosenbaum
Drillbit Taylor,Comedy,prison jealousy homeless person beach parents kids relationship,You get what you pay for,Owen Wilson Leslie Mann Josh Peck David Dorfman Nate Hartley,Steven Brill
The Quiet,Drama Thriller,depression christmas party deaf-mute daughter high school sports,Isn't it time everyone hears your secrets?,Elisha Cuthbert Camilla Belle Edie Falco Martin Donovan Shawn Ashmore,Jamie Babbit
Evil Words,Horror Mystery Thriller,suspense psychopathic killer hopital,,Patrick Huard Michel C\u00f4t\u00e9 Catherine Florent Albert Millaire Jean L'Italien,\u00c9ric Tessier
Dracula: Pages from a Virgin's Diary,Horror,dracula independent film,,Wei-Qiang Zhang Tara Birtwhistle David Moroni CindyMarie Small Johnny A. Wright,Guy Maddin
Fight to the Finish,Romance Action,sport fighting,It's all or nothing,Jennifer Hale Evan Hannemann Tonya Kay Anna Ross Tamara Rey,Warren Sheppard
Meet the Spartans,Comedy,fight queen penguin black hole men,"The Bigger the Hit, The Harder They Fall",Sean Maguire Carmen Electra Ken Davitian Kevin Sorbo Diedrich Bader,Jason Friedberg
Rachel Getting Married,Drama,sister independent film maid of honor,,Anne Hathaway Rosemarie DeWitt Sebastian Stan Roslyn Ruff Bill Irwin,Jonathan Demme
Transformers: Dark of the Moon,Action Science Fiction Adventure,moon spacecraft traitor bodyguard alien planet,The invasion we always feared. An enemy we never expected.,Shia LaBeouf John Malkovich Ken Jeong Frances McDormand Josh Duhamel,Michael Bay
Forbidden Kingdom,Thriller Adventure Mystery Fantasy,monster mystic church demon witchcraft,The truth is in you,Jason Flemyng Aleksey Chadov Agniya Ditkovskite Yuriy Tsurilo Olga Zaytseva,Oleg Stepchenko
The Theory of Everything,Drama Romance,wife husband relationship biography physicist based on memoir stephen hawking,His Mind Changed Our World. Her Love Changed His.,Eddie Redmayne Felicity Jones Charlie Cox Emily Watson Simon McBurney,James Marsh
Sorcerer,Action Thriller Adventure,dynamite car journey nicaragua criminal bandit,WANTED. Four men willing to drive a cargo of death to escape a life in hell.,Roy Scheider Bruno Cremer Francisco Rabal Amidou Ramon Bieri,William Friedkin
Moby Dick,Adventure Drama,based on novel captain boat obsession shipwreck,"From the immortal adventure classic...of whaling men, their ships, and the sea!",Gregory Peck Richard Basehart Leo Genn James Robertson Justice Harry Andrews,John Huston
Brazil,Comedy Science Fiction,bureaucracy police state terror great britain dream,It's only a state of mind.,Jonathan Pryce Robert De Niro Katherine Helmond Ian Holm Bob Hoskins,Terry Gilliam
