title,genres,keywords,tagline,cast,director
The Verdict,Drama,boston court malpractice alcoholic courtroom,"The doctors want to settle, the Church wants to settle, their lawyers want to settle, and even his own clients are desperate to settle. But Galvin is determined to defy them all. He will try the case.",Paul Newman Charlotte Rampling Jack Warden James Mason Milo O'Shea,Sidney Lumet
The Legend of God's Gun,Action Western,,,Robert Bones Kirpatrick Thomas Dave Koenig Julie Patterson,Mike Bruce
All The Queen's Men,Action Comedy Drama History,transvestism world war ii,,Matt LeBlanc Eddie Izzard James Cosmo Nicolette Krebitz David Tristan Birkin,Stefan Ruzowitzky
Bathing Beauty,Comedy Music,musical girls' boarding school swimming pool romantic comedy,M.G.M's Mammoth Technicolor Musical Spectacle!,Red Skelton Esther Williams Basil Rathbone Bill Goodwin Jean Porter,George Sidney
Breakfast of Champions,Comedy,wife husband relationship success author extramarital affair,,Bruce Willis Albert Finney Nick Nolte Barbara Hershey Glenne Headly,Alan Rudolph
All About Steve,Comedy,blind date eccentric aftercreditsstinger crossword puzzle mine shaft,A Comedy That Clings,Sandra Bullock Thomas Haden Church Bradley Cooper Ken Jeong DJ Qualls,Phil Traill
Ghost World,Comedy Drama,high school friends art class record collector plaster personal ad,Accentuate the negative.,Thora Birch Scarlett Johansson Steve Buscemi Brad Renfro Bob Balaban,Terry Zwigoff
Legend,Crime Thriller,biography based on true story gangster twins,"Love, fight, live, rule like a legend.",Tom Hardy Emily Browning Christopher Eccleston David Thewlis Taron Egerton,Brian Helgeland
I Origins,Science Fiction Drama,independent film eyes molecular biologist,,Michael Pitt Brit Marling Astrid Berg\u00e8s-Frisbey Steven Yeun Archie Panjabi,Mike Cahill
Waltz with Bashir,Drama Animation War,israel palestine middle east lebanon nightmare,,Ari Folman Ron Ben-Yishai Dror Harazi Ronny Dayag,Ari Folman
Bled,Horror,vampire daywalker,Every addiction has its price.,Sarah Farooqui Chris Ivan Cevic Alex Petrovitch Michele Morrow Ivan L. Moody,Christopher Hutson
A Knight's Tale,Adventure Drama Romance Action,poetry knight tournament duel torture,He Will Rock You,Heath Ledger Rufus Sewell Shannyn Sossamon Paul Bettany Laura Fraser,Brian Helgeland
It's Complicated,Comedy Romance,graduation ex husband woman director,First comes marriage. Then comes divorce. And then...,Meryl Streep Alec Baldwin Steve Martin John Krasinski Lake Bell,Nancy Meyers
My Life Without Me,Drama Romance,farewell responsability dying and death night shift daughter,,Sarah Polley Amanda Plummer Scott Speedman Leonor Watling Deborah Harry,Isabel Coixet
Friday the 13th Part VI: Jason Lives,Horror Mystery Thriller,lightning cemetery mask slasher jason vorhees,Kill or be killed!,Thom Mathews Jennifer Cooke David Kagen Ren\u00e9e Jones Tom Fridley,Tom McLoughlin
Margaret,Drama,new york bus nightmare witness investigation,,Anna Paquin Matt Damon Mark Ruffalo Matthew Broderick Jeannie Berlin,Kenneth Lonergan
Gangster's Paradise: Jerusalema,Drama Action Crime Foreign,hearing gang of thieves organized crime,Welcome to the promised land.,Daniel Buckland Robert Hobbs Rapulana Seiphemo Jeffrey Zekele Ronnie Nyakale,Ralph Ziman
Disturbing Behavior,Mystery Horror Science Fiction,suicide sex island nightmare chase,In Cradle Bay it doesnâ€™t matter if youâ€™re not perfect.  You will be.,James Marsden Katie Holmes Nick Stahl Steve Railsback Bruce Greenwood,David Nutter
Max Payne,Action,assassin based on video game aftercreditsstinger,When a Man Has Lost Everything. He Only has Revenge,Mark Wahlberg Mila Kunis Beau Bridges Ludacris Chris O'Donnell,John Moore
Barney's Version,Comedy Drama,suicide jealousy canada independent film politically incorrect,First he got married. Then he got married again. Then he met the love of his life.,Paul Giamatti Dustin Hoffman Rosamund Pike Minnie Driver Rachelle Lefevre,Richard J. Lewis
Child's Play,Horror Thriller,gun birthday voodoo toy stalker,Chucky is one mean S.O.B.,Catherine Hicks Chris Sarandon Alex Vincent Brad Dourif Dinah Manoff,Tom Holland
Bangkok Dangerous,Action Crime Thriller,assassin asia gun deaf-mute hitman,There's only one way out.,Nicolas Cage Shahkrit Yamnarm Charlie Yeung Panward Hemmanee Nirattisai Kaljaruek,Danny Pang
The Wash,Action Comedy,sex fight music illegal drug black american stereotype,"When you're down 'n dirty, it all comes out in...",Dr. Dre Snoop Dogg DJ Pooh Angell Conwell Bruce Bruce,DJ Pooh
Alatriste,Action,,,Viggo Mortensen Elena Anaya Unax Ugalde Eduard Fern\u00e1ndez Eduardo Noriega,Agust\u00edn D\u00edaz Yanes
Snow Falling on Cedars,Drama Romance,journalist japanese wife fisherman war,From the director of 'Shine',Ethan Hawke Youki Kudoh Reeve Carney Anne Suzuki Rick Yune,Scott Hicks
Ararat,War Drama,destruction of a civilization turkey,,Simon Abkarian Charles Aznavour Christopher Plummer Arsin\u00e9e Khanjian David Alpay,Atom Egoyan
Free State of Jones,War Action Drama History Thriller,slavery american civil war,Based on the incredible true story.,Matthew McConaughey Gugu Mbatha-Raw Mahershala Ali Keri Russell Jacob Lofland,Gary Ross
The Taking of Pelham 1 2 3,Thriller Drama Crime,hostage new york city new york subway subway train stock market,I can't get it out of my head. I'm gonna die today.,Denzel Washington John Travolta Luis Guzm\u00e1n Victor Gojcaj John Turturro,Tony Scott
Our Brand Is Crisis,Comedy Drama,bolivia woman political campaign south america year 2002,May the best campaign win.,Sandra Bullock Anthony Mackie Billy Bob Thornton Zoe Kazan Scoot McNairy,David Gordon Green
Red Cliff,Adventure Drama Action,flaming arrow chinese history strategy carrier pigeon spear throwing,The future will be decided.,Chang Chen Hu Jun Tony Leung Chiu-Wai Takeshi Kaneshiro Song Jia,John Woo
Max,Adventure Drama Family,afghanistan war based on true story rescue betrayal,Best Friend. Hero. Marine.,Thomas Haden Church Josh Wiggins Lauren Graham Robbie Amell Mia Xitlali,Boaz Yakin
The Twilight Saga: New Moon,Adventure Fantasy Drama Romance,moon cinema vampire werewolf fang vamp,The Next Chapter Begins.,Kristen Stewart Robert Pattinson Taylor Lautner Billy Burke Ashley Greene,Chris Weitz
Fugly,Comedy Drama Thriller,,,Jimmy Shergill Mohit Marwah Kiara Advani Vijendar Singh Arfi Lamba,Kabir Sadanand
The Good Heart,Drama Comedy Romance,san francisco homeless person bar suicide attempt heart attack,Everyone needs a refuge from the world.,Brian Cox Paul Dano Stephanie Szostak Isild Le Besco Bill Buell,Dagur K\u00e1ri
Dawn of the Planet of the Apes,Science Fiction Action Drama Thriller,leader colony post-apocalyptic dystopia forest,One last chance for peace.,Andy Serkis Jason Clarke Gary Oldman Keri Russell Toby Kebbell,Matt Reeves
Indignation,Drama,based on novel jewish life ohio 1950s,Based on the novel by Philip Roth.,Logan Lerman Sarah Gadon Tracy Letts Linda Emond Danny Burstein,James Schamus
College,Comedy,sexuality college girlfriend vomit celebration,,Drake Bell Andrew Caldwell Andree Moss Carolyn Moss Wendy Talley,Deb Hagan
The Score,Action Crime Thriller,quebec jewel scepter customs house jewelry heist,There are no partners in crime,Robert De Niro Edward Norton Marlon Brando Angela Bassett Paul Soles,Frank Oz
Freaky Deaky,Comedy,bomb squad ex-fugitive freaky,Crime is such a trippy thing,Christian Slater Michael Jai White Crispin Glover Billy Burke Breanne Racano,Charles Matthau
A Very Harold & Kumar Christmas,Comedy,holiday indian lead beer christmas tree cannabis,Christmas comes prematurely.,Neil Patrick Harris John Cho Elias Koteas Danneel Ackles Kal Penn,Todd Strauss-Schulson
Renaissance,Action Animation Science Fiction,paris japanese identity underworld monopoly,Paris 2054. Live forever or die trying,Daniel Craig Catherine McCormack Romola Garai Jonathan Pryce Ian Holm,Christian Volckman
Bruce Almighty,Fantasy Comedy,christianity moon responsability moses street gang,In Bruce we trust,Jim Carrey Jennifer Aniston Philip Baker Hall Catherine Bell Lisa Ann Walter,Tom Shadyac
October Baby,Drama,adoption college,Every Life Is Beautiful,Rachel Hendrix  Jason Burkey Robert Amaya  John Schneider,Andrew Erwin
Frozen River,Drama,human trafficking woman director,,Melissa Leo Misty Upham Charlie McDermott John Canoe Jay Klaitz,Courtney Hunt
White Noise 2: The Light,Thriller Drama Horror Fantasy,suicide murder,Sometimes they don't come back alone.,Nathan Fillion Katee Sackhoff Craig Fairbrass Adrian Holmes Teryl Rothery,Patrick Lussier
Up in the Air,Drama Romance,suitcase business omaha on the road downsizing,The story of a man ready to make a connection.,George Clooney Vera Farmiga Anna Kendrick Jason Bateman Melanie Lynskey,Jason Reitman
Jungle Shuffle,Family Animation Adventure,poacher jungle,,Drake Bell Rob Schneider Brianne Siddall Joey D'Auria Jessica DiCicco,Taedong Park
Donovan's Reef,Adventure Comedy Romance,birthday half-brother priest mission clinic polynesia,Gangway...For This Years BIG Adventure!,John Wayne Elizabeth Allen Lee Marvin Cesar Romero Mike Mazurki,John Ford
Jackass: The Movie,Documentary Comedy,disgust pain stunts music video stuntman,Do not attempt this at home.,Johnny Knoxville Bam Margera Steve-O Chris Pontius Dave England,Jeff Tremaine
Evita,History Drama Music,prostitute deification dancehall hostess per\u00f3nism argentine president,The Most Anticipated Motion Picture Event of The Year,Madonna Antonio Banderas Jonathan Pryce Jimmy Nail Victoria Sus,Alan Parker
2 Fast 2 Furious,Action Crime Thriller,miami car race sports car los angeles car,How Fast Do You Want It?,Paul Walker Tyrese Gibson Eva Mendes Cole Hauser Ludacris,John Singleton
The Sum of All Fears,Thriller Action Drama,cia terrorist atomic bomb cold war nuclear explosion,"27,000 nuclear weapons. One is missing.",Ben Affleck Morgan Freeman James Cromwell Ken Jenkins Liev Schreiber,Phil Alden Robinson
Mars Needs Moms,Adventure Animation Family,boy alien rescue martian alien abduction,Mom needs a little space.,Seth Green Joan Cusack Dan Fogler Breckin Meyer Elisabeth Harnois,Simon Wells
Sphere,Science Fiction,ocean extraterrestrial technology space marine paranoia raumschiffabsturz,"A thousand feet beneath the sea, the blackest holes are in the mind...",Dustin Hoffman Sharon Stone Samuel L. Jackson Peter Coyote Liev Schreiber,Barry Levinson
Jarhead,Drama War,sniper marine corps saudi arabia petrol golf war,Welcome to the suck.,Jamie Foxx Jake Gyllenhaal Scott MacDonald Lucas Black Peter Sarsgaard,Sam Mendes
Valentine's Day,Comedy Romance,flower married couple florist kiss single,A Love Story. More or Less.,Jessica Alba Jessica Biel Bradley Cooper Eric Dane Patrick Dempsey,Garry Marshall
Species,Science Fiction Horror Action,telepathy dna paranoia genetics instinct,Our time is up.,Natasha Henstridge Ben Kingsley Michael Madsen Alfred Molina Forest Whitaker,Roger Donaldson
My Super Ex-Girlfriend,Fantasy Drama Action Comedy Crime,new york flying ex-boyfriend ex-girlfriend disappointment,Hell hath no fury like a superwoman scorned.,Uma Thurman Luke Wilson Anna Faris Eddie Izzard Rainn Wilson,Ivan Reitman
"Sex, Lies, and Videotape",Drama,sexual obsession sex sexuality camcorder spanner,,Andie MacDowell Peter Gallagher James Spader Laura San Giacomo Ron Vawter,Steven Soderbergh
The Last Godfather,Action Comedy Thriller,,,Harvey Keitel Jason Mewes Blake Clark Jon Polito Paul Hipp,Shim Hyung-Rae
Jason Bourne,Action Thriller,assassin amnesia flashback,You know his name,Matt Damon Alicia Vikander Tommy Lee Jones Vincent Cassel Julia Stiles,Paul Greengrass
The Muppet Christmas Carol,Comedy Family Fantasy Drama,holiday future musical past scrooge,,Michael Caine Don Austen Meredith Braun Don Austen Ed Sanders,Brian Henson
Earth to Echo,Family Adventure Science Fiction,alien found footage,No one will ever believe our story.,Teo Halm Astro Resse Hartwig Ella Wahlestedt Jason Gray-Stanford,Dave Green
Anonymous,Drama History Thriller,shakespeare anonymity poet play political,Was Shakespeare a Fraud?,Jamie Campbell Bower Rhys Ifans David Thewlis Joely Richardson Vanessa Redgrave,Roland Emmerich
The Interview,Action Comedy,cia coup d'etat north korea assassination attempt evil dictator,The Film Hackers Tried To Get Banned,James Franco Seth Rogen Lizzy Caplan Randall Park Diana Bang,Seth Rogen
The Bourne Legacy,Action Thriller,assassin wolf maryland suicide by gunshot rooftop,There Was Never Just One,Jeremy Renner Rachel Weisz Edward Norton Scott Glenn Stacy Keach,Tony Gilroy
Kabhi Alvida Naa Kehna,Drama Romance,adultery extramarital affair,A Love.... That Broke All Relationships,Shah Rukh Khan Rani Mukerji Preity Zinta Abhishek Bachchan Amitabh Bachchan,Karan Johar
Carlos,Crime Drama Thriller History,gun car bomb miniseries terrorism opec,The man who hijacked the world,Edgar Ram\u00edrez Alexander Scheer Fadi Abi Samra Nora von Waldst\u00e4tten Talal El-Jordi,Olivier Assayas
A Bridge Too Far,Drama History War,netherlands world war ii panzer british soldier,Out of the sky comes the screen's most incredible spectacle of men and war!,Dirk Bogarde James Caan Michael Caine Sean Connery Edward Fox,Richard Attenborough
Rodeo Girl,Family,,,Kevin Sorbo Sophie Bolen Derek Brandon Carrie Bradstreet Tiffany Burns,Joel Paul Reisig
The Angry Birds Movie,Family Animation,island bird pig talking animal based on video game,Why so angry?,Jason Sudeikis Josh Gad Danny McBride Maya Rudolph Bill Hader,Fergal Reilly
Concussion,Drama,american football concussion biography professional sports brain damage,Even Legends Need a Hero,Will Smith Alec Baldwin Albert Brooks Gugu Mbatha-Raw David Morse,Peter Landesman
Antibirth,Horror,drug abuse experiment television conspiracy alien abduction,,Natasha Lyonne Chlo\u00eb Sevigny Meg Tilly Mark Webber Maxwell McCabe-Lokos,Danny Perez
Exiled,Action Crime Thriller,,,Anthony Wong Francis Ng Simon Yam Nick Cheung Richie Ren,Johnnie To
The Class,Drama,paris socially deprived family literature illegal immigration immigrant,The dynamics of a multicultural class and its teacher will enlighten.,Fran\u00e7ois B\u00e9gaudeau Franck Ke\u00efta Esmeralda Ouertani Rachel Regulier Wei Huang,Laurent Cantet
The Replacements,Comedy,american football strike sport coach misfit,Throw the ball. Catch the girl. Keep it simple.,Keanu Reeves Gene Hackman Brooke Langton Orlando Jones Faizon Love,Howard Deutch
Dragonball Evolution,Action Adventure Fantasy Science Fiction Thriller,karate superhero revenge dragon duringcreditsstinger,The legend comes to life.,Chow Yun-fat Justin Chatwin Joon Park Jamie Chung Emmy Rossum,James Wong
The Tigger Movie,Animation Family,owl donkey tiger piglet bear,,Jim Cummings Nikita Hopkins Ken Sansom John Fiedler Peter Cullen,Jun Falkenstein
Nurse Betty,Comedy Crime Thriller,independent film native american violence soap opera used car dealer,She's chasing a dream... they're chasing her.,Ren\u00e9e Zellweger Morgan Freeman Chris Rock Greg Kinnear Aaron Eckhart,Neil LaBute
Spanglish,Comedy,upper class mother single parent parents kids relationship wife husband relationship,Every family has a hero.,Adam Sandler T\u00e9a Leoni Paz Vega Cloris Leachman Shelbie Bruce,James L. Brooks
Super Troopers,Comedy Crime Mystery,alcohol radio police chief highway cops,,Jay Chandrasekhar Steve Lemme Kevin Heffernan Paul Soter Geoffrey Arend,Jay Chandrasekhar
Kit Kittredge: An American Girl,Comedy Drama Family,cincinnati woman director,"Kit Kittredge, a resourceful young girl, helps her mother run a boardinghouse after her father loses his job.",Abigail Breslin Chris O'Donnell Julia Ormond Stanley Tucci Joan Cusack,Patricia Rozema
No Country for Old Men,Crime Drama Thriller,texas drug traffic hitman united states\u2013mexico barrier suspense,There are no clean getaways.,Tommy Lee Jones Javier Bardem Josh Brolin Woody Harrelson Kelly Macdonald,Joel Coen
Insidious,Horror Thriller,medium evil spirit house warming aftercreditsstinger,It's not the house that's haunted.,Patrick Wilson Rose Byrne Ty Simpkins Barbara Hershey Lin Shaye,James Wan
The Lost Medallion: The Adventures of Billy Stone,Adventure Family,,Finding it is only the beginning.,William Brent Sammi Hanratty James Hong Alex Kendrick Mark Dacascos,Bill Muir
Show Me,Drama Thriller,kidnapping,,Michelle Nolden Katharine Isabelle Kett Turton Gabriel Hogan Allegra Fulton,Cassandra Nicolaou
Blue Crush,Adventure,sea surfer hawaii sport job,"Three Friends, One Passion, No Limits.",Kate Bosworth Matthew Davis Michelle Rodriguez Sanoe Lake Mika Boorem,John Stockwell
Little Miss Sunshine,Comedy Drama,california brother sister relationship wife husband relationship family's daily life oscar award,A family on the verge of a breakdown,Greg Kinnear Toni Collette Steve Carell Paul Dano Abigail Breslin,Jonathan Dayton
Step Brothers,Comedy,becoming an adult autonomy childhood trauma hostility step brother,They grow up so fast.,Will Ferrell John C. Reilly Mary Steenburgen Richard Jenkins Adam Scott,Adam McKay
Sugar Town,Comedy,woman director,,John Taylor Michael Des Barres Martin Kemp Jade Gordon Larry Klein,Allison Anders
Kindergarten Cop,Comedy,crime fighter cook drug dealer dying and death kindergarten,"Go ahead, you tell him you didn't do your homework.",Arnold Schwarzenegger Penelope Ann Miller Pamela Reed Linda Hunt Richard Tyson,Ivan Reitman
Hereafter,Drama Fantasy,,Touched by death. Changed by life.,Matt Damon Bryce Dallas Howard George McLaren Thierry Neuvic Cyndi Mayo Davis,Clint Eastwood
Avatar,Action Adventure Fantasy Science Fiction,culture clash future space war space colony society,Enter the World of Pandora.,Sam Worthington Zoe Saldana Sigourney Weaver Stephen Lang Michelle Rodriguez,James Cameron
Antarctic Edge: 70Â° South,Documentary,woman director,,,Dena Seidel
The Opposite Sex,Comedy,bet divorce gender battle of the sexes life competition,"A battle of the sexes, winner takes all.",Mena Suvari Eric Roberts Kristin Chenoweth Dana Ashbrook Kenan Thompson,Jonathan Silverman
Roger & Me,Documentary History,capitalism economics unemployment corporate greed,,Michael Moore Roger B. Smith Rhonda Britton Fred Ross,Michael Moore
Made in Dagenham,Comedy Drama History,machinist aftercreditsstinger duringcreditsstinger equal pay discrimination,"In the fight for equal rights, an ordinary woman achieves something extraordinary.",Sally Hawkins Bob Hoskins Miranda Richardson Geraldine James Simon Nehan,Nigel Cole
Legally Blonde,Comedy,harvard law school black female judge smart blonde girl power,Don't judge a book by its hair color!,Reese Witherspoon Luke Wilson Selma Blair Matthew Davis Victor Garber,Robert Luketic
Halloween III: Season of the Witch,Horror Mystery Science Fiction,commercial factory gas station curfew mask,...and now the earth will run with blood again!,Tom Atkins Stacey Nelkin Dan O'Herlihy Michael Currie Ralph Strait,Tommy Lee Wallace
Ocean's Twelve,Thriller Crime,sequel faberg\u00e9 egg dutch eastindian company second part,Twelve is the new eleven.,George Clooney Brad Pitt Catherine Zeta-Jones Julia Roberts Andy Garc\u00eda,Steven Soderbergh
Peggy Sue Got Married,Comedy Drama Fantasy Romance,time travel high school reunion,"Knowing what you know now, what would you do differently?",Kathleen Turner Nicolas Cage Barry Miller Catherine Hicks Joan Allen,Francis Ford Coppola
Force 10 from Navarone,Action Adventure War Thriller,gun traitor nazis bridge major,,Harrison Ford Robert Shaw Barbara Bach Edward Fox Franco Nero,Guy Hamilton
The Phantom,Adventure Action,secret identity gold gangster boss phantom silver,Slam Evil!,Billy Zane Kristy Swanson Treat Williams Catherine Zeta-Jones James Remar,Simon Wincer
Maggie,Horror,post-apocalyptic dystopia zombie,Don't Get Bitten,Arnold Schwarzenegger Abigail Breslin Joely Richardson Douglas M. Griffin J.D. Evermore,Henry Hobson
Rumble in the Bronx,Crime Action Comedy Thriller,new york martial arts supermarket gang war disabled child,No Fear. No Stuntman. No Equal.,Jackie Chan Anita Mui Fran\u00e7oise Yip Bill Tung Marc Akerstream,Stanley Tong
Friday the 13th Part III,Horror Thriller,lake summer camp murder serial killer slasher,There's nowhere to hide. We dare you to try.,Dana Kimmell Paul Kratka Tracie Savage Jeffrey Rogers Catherine Parks,Steve Miner
The Hunchback of Notre Dame,Drama Animation Family,paris based on novel judge obsession dance,,Tom Hulce Demi Moore Tony Jay Kevin Kline Paul Kandel,Gary Trousdale
Non-Stop,Action Thriller Mystery,airplane conspiracy airplane crash cell phone hijack,The hijacking was just the beginning.,Liam Neeson Julianne Moore Scoot McNairy Michelle Dockery Nate Parker,Jaume Collet-Serra
Once,Drama Music Romance,rock and roll pop irland music style love of one's life,How often do you find the right person?,Glen Hansard Mark\u00e9ta Irglov\u00e1 Hugh Walsh Gerard Hendrick Alaistair Foley,John Carney
My Bloody Valentine,Mystery Horror,sheriff miner delusion head injury remake,He's gonna break your heart.,Jensen Ackles Jaime King Kerr Smith Betsy Rue Edi Gathegi,Patrick Lussier
The Last Sin Eater,Drama,christianity appalachia conversion independent film,,Louise Fletcher Henry Thomas Soren Fulton A.J. Buckley Stewart Finlay-McLennan,Michael Landon Jr.
Mao's Last Dancer,Drama Romance,costume song village promise ballet,æœ€åŽçš„èˆžè€…,Chi Cao Chengwu Guo Wen Bin Huang Joan Chen Bruce Greenwood,Bruce Beresford
A Separation,Drama,emigration class money maid divorce,"Ugly truth, sweet lies.",Leila Hatami Kimia Hosseini Merila Zarei \u067e\u06cc\u0645\u0627\u0646 \u0645\u0639\u0627\u062f\u06cc Sareh Bayat,Asghar Farhadi
The Kite Runner,Drama,1970s afghanistan hang gliding war in afghanistan taliban,There is a way to be good again.,Khalid Abdalla Atossa Leoni Shaun Toub Zekeria Ebrahimi Ahmad Khan Mahmoodzada,Marc Forster
Town & Country,Comedy Romance,architect cellist friends anniversary,There's no such thing as a small affair.,Warren Beatty Diane Keaton Goldie Hawn Garry Shandling Andie MacDowell,Peter Chelsom
On The Downlow,Drama,confession hazing gang member latino lgbt,Two gangs. One secret. One crossroad.,Tony Sancho Michael Cortez Donato Cruz Felipe Camacho Carmen Cenko,Tadeo Garcia
Song One,Drama,woman director,A moment can change everything.,Anne Hathaway Johnny Flynn Mary Steenburgen Ben Rosenfield Lola Kirke,Kate Barker-Froyland
Not Easily Broken,Drama Romance,,,Morris Chestnut Taraji P. Henson Maeve Quinlan Kevin Hart Jenifer Lewis,Bill Duke
Planet of the Apes,Thriller Science Fiction Action Adventure,gorilla space marine space suit revolution chimp,You'll be sorry you were ever born human,Mark Wahlberg Tim Roth Helena Bonham Carter Michael Clarke Duncan Kris Kristofferson,Tim Burton
Beverly Hills Cop III,Action Comedy Crime,detective undercover security camera carousel  investigation,,Eddie Murphy Judge Reinhold H\u00e9ctor Elizondo Gilbert R. Hill Timothy Carhart,John Landis
You Only Live Twice,Action Thriller Adventure,london england japan england assassination helicopter,You Only Live Twice...and Twice is the only way to live!,Sean Connery Akiko Wakabayashi Karin Dor Mie Hama Tetsur\u014d Tamba,Lewis Gilbert
Code Name: The Cleaner,Action Comedy Crime,,,Cedric the Entertainer Lucy Liu Nicollette Sheridan Mark Dacascos Callum Keith Rennie,Les Mayfield
Safe Men,Comedy Crime,robbery organized crime gangster safecracker rosh hashanah,Welcome to the world of disorganised crime.,Sam Rockwell Steve Zahn Paul Giamatti Mark Ruffalo Josh Pais,John Hamburg
Dangerous Liaisons,Drama Romance,lovesickness sexuality cheating cynic ladykiller,Lust. Seduction. Revenge. The Game As You've Never Seen It Played Before.,Glenn Close John Malkovich Michelle Pfeiffer Swoosie Kurtz Keanu Reeves,Stephen Frears
The Ghastly Love of Johnny X,Comedy Fantasy Music,,They Sing! They Dance! They're Juvenile Delinquents from Outer Space!,Will Keenan Creed Bratton De Anna Joy Brooks Reggie Bannister Jed Rowen,Paul Bunnell
The Players Club,Drama,strip club stripper dominatrix cat fight,"Here, we get down and dirty.",LisaRaye McCoy Dick Anthony Williams Judyann Elder Chrystale Wilson Adele Givens,Ice Cube
A Night at the Roxbury,Comedy,night life nightclub flower flower shop make a match,Score!,Will Ferrell Chris Kattan Jennifer Coolidge Michael Clarke Duncan Eva Mendes,John Fortenberry
L.I.E.,Drama,independent film,"On the Long Island Expressway there are lanes going east, lanes going west, and lanes going straight to hell.",Paul Dano Bruce Altman Brian Cox Billy Kay James Costa,Michael Cuesta
The Rugrats Movie,Animation Family,brother brother relationship baby home pregnancy and birth sequel,,Whoopi Goldberg David Spade E.G. Daily Tara Strong Christine Cavanaugh,Norton Virgien
Twin Falls Idaho,Drama Romance,independent film,A different kind of love story.,Mark Polish Michael Polish Michele Hicks Jon Gries Patrick Bauchau,Michael Polish
Woo,Comedy Romance,"blind date love manhattan, new york city woman director",It's Woo's world.. we're just living in it.,Jada Pinkett Smith Tommy Davidson Duane Martin Michael Ralph Darrel Heath,Daisy von Scherler Mayer
It's a Wonderful Afterlife,Comedy Romance,london england indian lead murder matchmaking ghost,Finding the right man can be murder,Shabana Azmi Goldy Notay Sendhil Ramamurthy Sally Hawkins Mark Addy,Gurinder Chadha
Mulholland Drive,Thriller Drama Mystery,schizophrenia identity amnesia loss of sense of reality suppressed past,An actress longing to be a star. A woman searching for herself. Both worlds will collide... on Mulholland Drive.,Naomi Watts Laura Harring Ann Miller Dan Hedaya Justin Theroux,David Lynch
High School Musical,Comedy Drama Family Music TV Movie,becoming an adult musical music high school school performance,This School Rocks Like No Other!,Zac Efron Vanessa Hudgens Ashley Tisdale Lucas Grabeel Corbin Bleu,Kenny Ortega
